KEY;default;dk;de;nl;sl;no;se;fi;lt;fr;it;gr;pl;es;pt
adas.dss.0_0_4.models.IPMTOOL.description;THE PEST: This IPM planning tool provides information on all the major pests, weeds and diseases of many arable and outdoor horticultural crops.  THE DECISION: The user selects the crop types they grow.  The IPM Tool provides a list of the pests, weeds and diseases which affect each type of crop, together with identification guides.  The user selects the pests, weeds and diseases which are a problem on their farm. The Tool provides guidance on effective IPM  control methods for each of the pests, weeds and diseases selected.  Links are provided to independent sources of information about each method. The user can select those methods appropriate for their farming system.   An IPM crop plan is then produced, recording the IPM control methods planned.  The plan can be updated during  the crop season.  SOURCE: The IPM Tool was developed by ADAS and SRUC, in a project led by the NFU and funded by Defra. ASSUMPTIONS: The IPM Tool provides links to external sources of independent information from reputable sources, but over which the developers of the tool have no control. ;SKADEVOLDERE: Dette IPM-planlægningsværktøj giver information om alle de store skadedyr, ukrudt og sygdomme i mange mark- og udendørs afgrøder. BESLUTNING: Brugeren vælger de afgrødetyper, de dyrker. IPM-værktøjet giver en liste over de skadedyr, ukrudt og sygdomme, der påvirker hver type afgrøde, sammen med identifikationsvejledninger. Brugeren vælger de skadedyr, ukrudt og sygdomme, som er et problem på deres bedrift. Værktøjet giver vejledning om effektive IPM-bekæmpelsesmetoder for hvert af de udvalgte skadedyr, ukrudt og sygdomme. Der gives links til uafhængige kilder til information om hver metode. Brugeren kan vælge de metoder, der passer til deres landbrugssystem. Der udarbejdes derefter en IPM-afgrødeplan, der registrerer de planlagte IPM-kontrolmetoder. Planen kan opdateres i løbet af afgrødesæsonen. KILDE: IPM-værktøjet er udviklet af ADAS og SRUC, i et projekt ledet af NFU og finansieret af Defra. FORUDSÆTNINGER: IPM-værktøjet giver links til eksterne kilder til uafhængig information fra velrenommerede kilder, men som udviklerne af værktøjet ikke har nogen kontrol over.;SCHADERREGER: Dieses Planungsinstrument für den Intergrierten Pflanzenschutz (engl. IPM)  liefert Informationen über alle wichtigen Schädlinge, Unkräuter und Krankheiten zahlreicher Acker- und Gartenbaukulturen im Freien.  ENTSCHEIDUNG: Der Nutzer wählt die Kulturarten aus, die er anbaut.  Das IPM-Tool enthält eine Liste der Schädlinge, Unkräuter und Krankheiten, die die einzelnen Kulturarten befallen, sowie eine Anleitung zur Identifizierung.  Der Nutzer wählt die Schädlinge, Unkräuter und Krankheiten aus, die in seinem Betrieb ein Problem darstellen. Das Tool bietet Anleitungen zu wirksamen IPM-Bekämpfungsmethoden für jeden der ausgewählten Schädlinge, Unkräuter und Krankheiten.  Zu jeder Methode werden Links zu unabhängigen Informationsquellen angegeben. Der Benutzer kann die Methoden auswählen, die für sein Anbausystem geeignet sind.   Anschließend wird ein IPM-Anbauplan erstellt, in dem die geplanten IPM-Bekämpfungsmethoden festgehalten werden.  Der Plan kann während der Anbausaison aktualisiert werden.  QUELLE: Das IPM-Tool wurde von ADAS und SRUC im Rahmen eines von der NFU geleiteten und vom Defra finanzierten Projekts entwickelt. ANNAHMEN: Das IPM-Tool enthält Links zu externen Quellen mit unabhängigen Informationen aus seriösen Quellen, auf die die Entwickler des Tools jedoch keinen Einfluss haben. ;DE PLAAG: Dit IPM-planningsinstrument geeft informatie over alle belangrijke plagen, onkruiden en ziekten van vele akker- en tuinbouwgewassen. DE BESLISSING: De gebruiker selecteert de gewassoorten die hij teelt.  De IPM-tool geeft een lijst van plagen, onkruiden en ziekten die elk type gewas aantast, samen met identificatiegidsen.  De gebruiker selecteert de plagen, onkruiden en ziekten die een probleem vormen op zijn bedrijf. De tool geeft richtlijnen voor effectieve IPM-bestrijdingsmethoden voor elk van de geselecteerde plagen, onkruiden en ziekten.  Er zijn links naar onafhankelijke informatiebronnen over elke methode. De gebruiker kan de methoden selecteren die geschikt zijn voor zijn landbouwsysteem.  Vervolgens wordt een IPM-gewasplan opgesteld, waarin de geplande IPM-bestrijdingsmethoden worden vastgelegd.  Het plan kan tijdens het teeltseizoen worden bijgewerkt.  BRON: Het IPM-instrument is ontwikkeld door ADAS en SRUC, in het kader van een door de NFU geleid en door Defra gefinancierd project. AANNAMES: De IPM-tool bevat links naar externe bronnen met onafhankelijke informatie uit gerenommeerde bronnen, waarover de ontwikkelaars van de tool echter geen controle hebben. ;ŠKODLJIV ORGANIZEM: To orodje za načrtovanje integriranega varstva rastlin (IVR) vsebuje informacije o vseh glavnih škodljivcih, plevelih in boleznih številnih poljščin in vrtnin na prostem.  ODLOČITEV: Uporabnik izbere vrste pridelkov, ki jih goji. Orodje IPM Tool vsebuje seznam škodljivcev, plevelov in bolezni, ki prizadenejo vsako vrsto pridelka, skupaj z navodili za prepoznavanje.  Uporabnik izbere škodljivce, plevele in bolezni, ki predstavljajo težavo na njegovi kmetiji. Orodje vsebuje navodila za učinkovite metode IVR za obvladovanje vsakega od izbranih škodljivcev, plevelov in bolezni.  Na voljo so povezave do neodvisnih virov informacij o vsaki metodi. Uporabnik lahko izbere metode, ki so primerne za njegov kmetijski sistem. Nato se izdela načrt pridelave, v katerem so zapisane načrtovane metode IVR.  Načrt se lahko med pridelovalno sezono posodablja.  VIR: Orodje IPM sta razvila ADAS in SRUC v okviru projekta, ki ga je vodila NFU, financirala pa Defra. PREDPOSTAVKE: Orodje IPM vsebuje povezave do zunanjih virov neodvisnih informacij iz uglednih virov, nad katerimi pa razvijalci orodja nimajo nadzora. ;SKADEGJØREREN: Dette IPV-planleggingsverktøyet gir informasjon om alle de store skadedyrene, ugressene og sjukdommene i mange avlinger. AVGJØRELSEN: Brukeren velger avlingstypene de dyrker. IPV-verktøyet gir en liste over skadedyr, ugress og sjukdommer som påvirker hver type avling, sammen med identifikasjonsveiledninger. Brukeren velger skadedyr, ugress og sjukdommer som er et problem på gården deres. Verktøyet gir veiledning om effektive IPV-kontrollmetoder for hvert av de valgte skadedyrene, ugressene og sjukdommene. Det gis lenker til uavhengige informasjonskilder om hver metode. Brukeren kan velge de metodene som passer for deres drift. Etterpå lages en IPV-avlingsplan, som registrerer de planlagte IPV-kontrollmetodene. Planen kan oppdateres i løpet av dyrkningssesongen. KILDE: IPV-verktøyet er utviklet av ADAS og SRUC, i et prosjekt ledet av NFU og finansiert av Defra. FORUTSETNINGER: IPM-verktøyet gir lenker til eksterne kilder med uavhengig informasjon fra anerkjente kilder, men som utviklerne av verktøyet ikke har kontroll over.;SKADEGÖRAREN: Detta verktyg för planering av IPM ger information om alla större skadedjur, ogräs och sjukdomar i många jordbruks- och fältträdgårdsgrödor.  BESLUTET: Användaren väljer de grödtyper de odlar.  IPM-verktyget tillhandahåller en förteckning över skadedjur, ogräs och sjukdomar som påverkar varje typ av gröda, tillsammans med identifieringsguider.  Användaren väljer de skadedjur, ogräs och sjukdomar som är ett problem på deras gård. Verktyget ger vägledning om effektiva IPM-metoder för bekämpning av var och en av de utvalda skadegörarna, ogräsen och sjukdomarna.  Länkar ges till oberoende informationskällor om varje metod. Användaren kan välja de metoder som är lämpliga för deras odlingssystem.  En IPM-baserad odlingsplan för varje gröda tas sedan fram, och de planerade IPM-åtgärderna registreras.  Planen kan uppdateras under skördesäsongen.  KÄLLA: IPM-verktyget utvecklades av ADAS och SRUC, i ett projekt som leddes av NFU och finansierades av Defra. ANTAGANDEN: IPM-verktyget tillhandahåller länkar till externa källor till oberoende information från ansedda källor, men som utvecklarna av verktyget inte har någon kontroll över. ;"KASVINTUHOOJA: Tämä IPM-suunnittelutyökalu tarjoaa tietoa kaikista tärkeimmistä tuhohyönteisistä, rikkakasveista ja kasvitaudeista pelto- ja puutarhakasveilla.
PÄÄTÖS: Käyttäjä valitsee viljelemänsä kasvilajit. IPM-työkalu tarjoaa luettelon tuhohyönteisistä, rikkakasveista ja kasvitaudeista, jotka esiintyvät kyseisillä kasvilajeilla, sekä tunnistusoppaat. Käyttäjä valitsee tilallaan ongelmalliset tuhohyönteiset, rikkakasvit ja kasvitaudit. Työkalu antaa ohjeita tehokkaista IPM-torjuntamenetelmistä jokaiselle valitulle tuhohyönteiselle, rikkakasville ja kasvitaudille. Jokaisesta menetelmästä on linkkejä puolueettomiin tietolähteisiin. Käyttäjä voi valita viljelyjärjestelmäänsä sopivat menetelmät. Sitten laaditaan IPM-viljelysuunnitelma, johon kirjataan suunnitellut IPM-valvontamenetelmät. Suunnitelmaa voidaan päivittää kasvukauden aikana.
 LÄHDE: IPM-työkalun ovat kehittäneet ADAS ja SRUC NFU:n johtamassa ja Defran rahoittamassa projektissa.
OLETUKSET: IPM-työkalu tarjoaa linkkejä ulkopuolisiin puolueettomiin tietolähteisiin, mutta joihin työkalun kehittäjät eivät voi vaikuttaa.
";KENKSMINGIEJI ORGANIZMAI: Šioje IKOK planavimo priemonėje pateikiama informacija apie visus pagrindinius kenkėjus, piktžoles ir ligas daugelyje lauko ir sodo bei atviro grunto daržo augalų. SPRENDIMAS: Naudotojas pasirenka auginamų augalų rūšis. IPM Tool (IKOK įrankiai) pateikia kenkėjų, piktžolių ir ligų, pažeidžiančių atskirų rūšių augalus, sąrašą ir identifikavimo vadovus. Naudotojas pasirenka kenkėjus, piktžoles ir ligas, su kuriomis susiduriama jo ūkyje. Tool  pateikia veiksmingų IKOK metodų, taikomų kiekvienam pasirinktam kenkėjui, piktžolei ir ligai, gaires. Pateikiamos nuorodos į nepriklausomus informacijos apie kiekvieną metodą šaltinius. Naudotojas gali pasirinkti metodus, tinkamus jo ūkininkavimo sistemai. Tada sudaromas IKOK pasėlių planas, kuriame aprašomi planuojami IKOK metodai.  Planas gali būti atnaujinamas augalų sezono metu. ŠALTINIS: IPM Tools sukūrė ADAS ir SRUC, vykdydamos projektą, kuriam vadovavo NFU ir kurį finansavo Defra. PRIELAIDOS: IPM Tool  pateikiamos nuorodos į išorinius nepriklausomus informacijos šaltinius iš patikimų šaltinių, kurių Tool kūrėjai nekontroliuoja.;"LE BIOAGGRESSEUR : Cet outil de planification de la lutte intégrée fournit des informations sur tous les principaux ravageurs, mauvaises herbes et maladies de nombreuses grandes cultures  et légumes de plein champ. 
LA DÉCISION : L'utilisateur sélectionne les types de cultures qu'il cultive.  L'outil IPMTOOL fournit une liste des ravageurs, des mauvaises herbes et des maladies qui affectent chaque type de culture, ainsi que des guides d'identification.  L'utilisateur sélectionne les ravageurs, les mauvaises herbes et les maladies qui posent problème dans son exploitation. L'outil fournit des conseils sur les méthodes de lutte intégrée efficaces pour chacun des ravageurs, mauvaises herbes et maladies sélectionnés.  Des liens sont fournis vers des sources d'information indépendantes sur chaque méthode. L'utilisateur peut sélectionner les méthodes qui conviennent à son système agricole. Une stratégie IPM est alors produite, incluant les méthodes de contrôle IPM prévues.  Le plan peut être mis à jour au cours de la saison agricole. 
 SOURCE : L'outil IPMTOOL a été développé par ADAS et SRUC, dans le cadre d'un projet dirigé par le NFU et financé par Defra. 
HYPOTHÈSES : L'outil IPMTOOL fournit des liens vers des sources externes d'informations indépendantes provenant de sources de confiance, mais sur lesquelles les développeurs de l'outil n'ont aucun contrôle. 
";Il parassita: questo strumento di pianificazione IPM fornisce informazioni su tutti i principali parassiti, erbe infestanti e malattie di molte colture orticole e seminativi.  LA DECISIONE: l'utente seleziona i tipi di colture che coltiva.  Lo strumento IPM fornisce un elenco di parassiti, erbe infestanti e malattie che colpiscono ogni tipo di coltura, insieme a guide per l'identificazione.  L'utente seleziona i parassiti, le erbe infestanti e le malattie che rappresentano un problema per la propria azienda. Lo strumento fornisce indicazioni sui metodi di controllo IPM efficaci per ciascuno dei parassiti, delle erbe infestanti e delle malattie selezionate.  Vengono forniti collegamenti a fonti di informazione indipendenti su ciascun metodo. L'utente può selezionare i metodi più adatti al proprio sistema agricolo.   Viene quindi prodotto un piano colturale IPM, che registra i metodi di controllo IPM previsti.  Il piano può essere aggiornato durante la stagione agricola.  FONTE: Lo strumento IPM è stato sviluppato da ADAS e SRUC, in un progetto guidato dalla NFU e finanziato dal Defra. ASSUNZIONI: Lo strumento IPM fornisce collegamenti a fonti esterne di informazioni indipendenti provenienti da fonti affidabili, ma sulle quali gli sviluppatori dello strumento non hanno alcun controllo.;Ο Εχθρός: Αυτό το εργαλείο σχεδιασμού IPM παρέχει πληροφορίες για όλους τους κύριους εχθρούς, ζιζάνια και ασθένειες πολλών αροτραίων και υπαίθριων κηπευτικών καλλιεργειών.  Η ΑΠΟΦΑΣΗ: Ο χρήστης επιλέγει τους τύπους καλλιεργειών που καλλιεργεί.  Το εργαλείο IPM παρέχει έναν κατάλογο των παρασίτων, ζιζανίων και ασθενειών που προσβάλλουν κάθε τύπο καλλιέργειας, μαζί με οδηγούς αναγνώρισης.  Ο χρήστης επιλέγει τα παράσιτα, τα ζιζάνια και τις ασθένειες που αποτελούν πρόβλημα στην εκμετάλλευσή του. Το Εργαλείο παρέχει καθοδήγηση σχετικά με αποτελεσματικές μεθόδους ελέγχου ΟΠΜ για καθένα από τα επιλεγμένα παράσιτα, ζιζάνια και ασθένειες.  Παρέχονται σύνδεσμοι προς ανεξάρτητες πηγές πληροφοριών για κάθε μέθοδο. Ο χρήστης μπορεί να επιλέξει εκείνες τις μεθόδους που είναι κατάλληλες για το γεωργικό του σύστημα.   Στη συνέχεια, παράγεται ένα σχέδιο καλλιέργειας IPM, στο οποίο καταγράφονται οι προγραμματισμένες μέθοδοι ελέγχου IPM.  Το σχέδιο μπορεί να επικαιροποιείται κατά τη διάρκεια της καλλιεργητικής περιόδου.  ΠΗΓΗ: Το εργαλείο IPM Tool αναπτύχθηκε από την ADAS και την SRUC, στο πλαίσιο ενός έργου υπό την καθοδήγηση της NFU και με τη χρηματοδότηση της Defra. ΥΠΟΘΕΣΕΙΣ: Το εργαλείο IPM Tool παρέχει συνδέσμους προς εξωτερικές πηγές ανεξάρτητων πληροφοριών από αξιόπιστες πηγές, επί των οποίων όμως οι προγραμματιστές του εργαλείου δεν έχουν κανέναν έλεγχο.;;;
adas.dss.0_0_4.models.IPMTOOL.name;IPM Tool for crop planning;IPM værktøj for afgrødeplanlægning;IPM-Tool für die Anbauplanung;IPM-tool voor gewasplanning;Orodje IVR za načrtovanje pridelave;IPV-verktøy for å planlegge avling;IPM-verktyg för odlingsplanering;IPM-työkalu kasvintuotannon suunnitteluun;IPM Tool (IKOK  priemonė) pasėlių planavimui;Outil IPMTOOL pour la planification des cultures;Strumento IPM per la pianificazione delle colture;Εργαλείο IPM για τον προγραμματισμό των καλλιεργειών;;;
adas.dss.0_0_4.models.IPMTOOL.purpose;Provides guidance on IPM control methods for specific pests, diseases and weeds;Giver vejledning om IPM bekæmpelsesmetoder for specifikke skadedyr, sygdomme og ukrudt;Bietet Anleitung zu IPM-Bekämpfungsmethoden für bestimmte Schädlinge, Krankheiten und Unkräuter;Biedt richtlijnen voor IPM-bestrijdingsmethoden voor specifieke plagen, ziekten en onkruiden.;Podaja navodila IVR pred določenimi škodljivci, boleznimi in pleveli.;Gir veiledning om IPV-metoder for å kontrollere spesifikke skadegjørere, sjukdommer og ugras.;Ger vägledning om bekämpningsmetoder enligt integrerat växtskydd för specifika skadegörare, sjukdomar och ogräs;Antaa ohjeita IPM-torjuntamenetelmistä tietyille tuhohyönteisille, kasvitaudeille ja rikkakasveille;Pateikiamos rekomendacijos dėl konkrečių kenkėjų, ligų ir piktžolių IKOK  metodų.;Fournit des conseils sur les méthodes de contrôle IPM pour des ravageurs, des maladies et des mauvaises herbes spécifiques.;Fornisce indicazioni sui metodi di controllo IPM per specifici parassiti, malattie ed erbe infestanti.;Παρέχει καθοδήγηση σχετικά με τις μεθόδους ελέγχου IPM για συγκεκριμένα παράσιτα, ασθένειες και ζιζάνια;;;
